{
 "listing": {
  "zpid": 27866230,
  "street_address": "932 Bennington St",
  "city": "Houston",
  "state": "TX",
  "zipcode": "77022",
  "home_type": "SINGLE_FAMILY",
  "beds": 4.0,
  "baths": 3.0,
  "living_area": 2976.0,
  "year_built": 1940.0,
  "lot_acres": 0.162350780532599,
  "lat": 29.82161,
  "lon": -95.35883,
  "days_on_zillow": 301.0,
  "page_views": 126.0,
  "favorites": 1.0,
  "agent_name": "Friday Brume",
  "broker_name": "RE/MAX East",
  "mls_id": "8028461",
  "photo_count": 15.0,
  "date_posted": "2023-08-08",
  "hdp_url": "https://www.zillow.com/homedetails/932-Bennington-St-Houston-TX-77022/27866230_zpid/",
  "list_price": 299900.0
 },
 "price": {
  "asking": 299900.0,
  "fair": 572314.0,
  "q10": 415222.0,
  "q90": 812568.0,
  "verdict": "low",
  "asking_vs_fair_pct": -47.6,
  "range_coverage": 0.7998,
  "receipt": [
   {
    "feature": "baseline",
    "label": "Neighborhood baseline ($174/sqft)",
    "usd": 516994.0,
    "pct": 90.3
   },
   {
    "feature": "livingArea",
    "label": "Size (2,976 sqft)",
    "usd": -27285.0,
    "pct": -4.8
   },
   {
    "feature": "age",
    "label": "Age (84 yrs)",
    "usd": 20973.0,
    "pct": 3.7
   },
   {
    "feature": "school_mean",
    "label": "Schools (avg 5.0/10)",
    "usd": -11876.0,
    "pct": -2.1
   },
   {
    "feature": "dist_downtown",
    "label": "Location (6.9 km to Downtown)",
    "usd": 147477.0,
    "pct": 25.8
   },
   {
    "feature": "bedrooms",
    "label": "Bedrooms (4)",
    "usd": -26030.0,
    "pct": -4.5
   },
   {
    "feature": "bathrooms",
    "label": "Bathrooms (3)",
    "usd": 177.0,
    "pct": 0.0
   },
   {
    "feature": "other",
    "label": "Other features & ML adjustment (pool, lot, HOA, text flags)",
    "usd": -48116.0,
    "pct": -8.4
   }
  ],
  "comps": [
   {
    "zpid": 84053048,
    "price": 419000.0,
    "ppsf": 148.6,
    "dist_km": 0.07,
    "beds": 3.0,
    "baths": 4.0,
    "sqft": 2820.0,
    "home_type": "SINGLE_FAMILY",
    "lat": 29.822212,
    "lon": -95.359055
   },
   {
    "zpid": 27866496,
    "price": 449900.0,
    "ppsf": 204.5,
    "dist_km": 0.67,
    "beds": 3.0,
    "baths": 3.0,
    "sqft": 2200.0,
    "home_type": "SINGLE_FAMILY",
    "lat": 29.827385,
    "lon": -95.36064
   },
   {
    "zpid": 27866479,
    "price": 328000.0,
    "ppsf": 137.4,
    "dist_km": 0.85,
    "beds": 5.0,
    "baths": 2.0,
    "sqft": 2387.0,
    "home_type": "SINGLE_FAMILY",
    "lat": 29.826626,
    "lon": -95.36551
   },
   {
    "zpid": 27865703,
    "price": 350000.0,
    "ppsf": 121.4,
    "dist_km": 1.16,
    "beds": 5.0,
    "baths": 3.0,
    "sqft": 2883.0,
    "home_type": "SINGLE_FAMILY",
    "lat": 29.829678,
    "lon": -95.35124
   },
   {
    "zpid": 27875665,
    "price": 580000.0,
    "ppsf": 171.8,
    "dist_km": 1.25,
    "beds": 3.0,
    "baths": 3.0,
    "sqft": 3377.0,
    "home_type": "SINGLE_FAMILY",
    "lat": 29.812115,
    "lon": -95.36569
   },
   {
    "zpid": 27875633,
    "price": 695000.0,
    "ppsf": 331.0,
    "dist_km": 1.41,
    "beds": 3.0,
    "baths": 2.0,
    "sqft": 2100.0,
    "home_type": "SINGLE_FAMILY",
    "lat": 29.810402,
    "lon": -95.3656
   },
   {
    "zpid": 27875000,
    "price": 699900.0,
    "ppsf": 288.3,
    "dist_km": 1.44,
    "beds": 3.0,
    "baths": 3.0,
    "sqft": 2428.0,
    "home_type": "SINGLE_FAMILY",
    "lat": 29.808798,
    "lon": -95.3607
   },
   {
    "zpid": 346714546,
    "price": 674900.0,
    "ppsf": 278.0,
    "dist_km": 1.44,
    "beds": 3.0,
    "baths": 3.0,
    "sqft": 2428.0,
    "home_type": "SINGLE_FAMILY",
    "lat": 29.808798,
    "lon": -95.3607
   }
  ],
  "comps_rule": "same type, beds \u00b11, sqft \u00b130%"
 },
 "verification": {
  "signals": [
   {
    "name": "asking_far_below_range",
    "status": "warning",
    "evidence": "Asking $299,900 is 72% of the low end of the fair range (q10 $415,222); warning below 85%. Prices far under comparable homes are a common lure in listing scams."
   },
   {
    "name": "duplicate_photos",
    "status": "ok",
    "evidence": "No photo is reused by a listing from a different broker.",
    "related_zpids": []
   },
   {
    "name": "duplicate_description",
    "status": "ok",
    "evidence": "Description is not copied by any listing from a different broker.",
    "related_zpids": []
   },
   {
    "name": "agent_broker_attribution",
    "status": "ok",
    "evidence": "Agent Friday Brume (TREC #0542875), broker RE/MAX East, MLS HAR #8028461. Verify the license at trec.texas.gov."
   },
   {
    "name": "size_vs_comps",
    "status": "ok",
    "evidence": "2,976 sqft vs median 2,352 sqft for 30 nearby 4-bed homes (1.27x)."
   },
   {
    "name": "engagement_anomaly",
    "status": "ok",
    "evidence": "301 days on Zillow, 126 views, 1 saves (within the normal range for its home type)."
   }
  ]
 },
 "costs": {
  "monthly": {
   "mortgage": 1535.6,
   "tax": 399.87,
   "hoa": "unknown",
   "insurance": "unknown",
   "total_known": 1935.47
  },
  "assumptions": [
   "30-yr fixed rate 6.621% (Zillow Home Loans rate shown on the listing, snapshot 2024-06-05).",
   "20% down ($59,980); loan $239,920; principal and interest only; no PMI at 20% down.",
   "Property tax = 1.60% x asking price / 12. Actual tax uses the appraised value, and rates change yearly."
  ],
  "unknowns": [
   "HOA fee not disclosed in the listing (absence does not mean $0).",
   "Homeowners insurance: no quote (Zillow shows an unverified estimate of $1,260/yr, not included).",
   "Flood insurance: depends on FEMA zone and elevation, check before buying in Houston.",
   "MUD/PID district taxes may not be included in the listed tax rate.",
   "Utilities, maintenance and closing costs are not included."
  ]
 },
 "sources": [
  {
   "name": "Zillow listing snapshot",
   "detail": "Houston Housing Market 2024 dataset (Kaggle), scraped 2024-06-05",
   "license": "CC BY-NC-SA 4.0"
  },
  {
   "name": "Fair-price range",
   "detail": "LightGBM quantile models (q10/q50/q90), 5-fold spatial block CV, cross-fold conformal calibration; out-of-fold coverage 0.7998 (target 0.80)"
  },
  {
   "name": "Price receipt",
   "detail": "Geographically weighted regression (k=200, computed in q/kdb+); items sum to the fair price"
  },
  {
   "name": "Comparable homes",
   "detail": "Nearest listings in the same snapshot (asking prices, not sales)"
  },
  {
   "name": "Mortgage rate",
   "detail": "Zillow Home Loans 30-yr fixed rate embedded in the listing"
  }
 ],
 "limitations": [
  "Asking prices only; no closed-sale prices. 'Fair' means consistent with comparable listings.",
  "One snapshot (June 2024); no market trend adjustment.",
  "The 80% range is calibrated per home type across Houston; individual neighborhoods may be covered more or less often.",
  "Verification signals are evidence for a human to check, not a fraud score.",
  "No inspection, title, flood-zone, or permit data."
 ]
}